{
  "date": "2026-07-25",
  "dayIndex": 8,
  "label": "第八日 · 7/25（六）解七日",
  "participants": [
    "fahui"
  ],
  "sections": [
    {
      "id": "d8-sec-1",
      "title": "起板 · 晨間準備",
      "timePoints": [
        {
          "id": "d8-tp-01",
          "time": {
            "kind": "exact",
            "value": "04:40",
            "rangeEnd": null,
            "raw": "04:40",
            "anchorTimePointId": null,
            "offsetMinutes": null
          },
          "isBellRow": false,
          "periodLabel": "晨間準備",
          "leadMinutesOverride": null,
          "tasks": [
            {
              "id": "d8-tp-01-t1",
              "action": "起床",
              "templateRef": null,
              "owners": [
                "all"
              ],
              "ownerRaw": "全體",
              "signal": null,
              "note": null
            },
            {
              "id": "d8-tp-01-t2",
              "action": "上香，新禪堂先不上",
              "templateRef": null,
              "owners": [
                "fahui"
              ],
              "ownerRaw": "法輝",
              "signal": null,
              "note": "早課、晚課上香皆三支"
            },
            {
              "id": "d8-tp-01-t3",
              "action": "上供水",
              "templateRef": null,
              "owners": [
                "fahui"
              ],
              "ownerRaw": "法輝",
              "signal": null,
              "note": "解七香板，4支，女眾監香1支"
            },
            {
              "id": "d8-tp-01-t4",
              "action": "開前鐵門、側門",
              "templateRef": null,
              "owners": [
                "fahui"
              ],
              "ownerRaw": "法輝",
              "signal": null,
              "note": null
            }
          ]
        },
        {
          "id": "d8-tp-02",
          "time": {
            "kind": "exact",
            "value": "04:55",
            "rangeEnd": null,
            "raw": "04:55",
            "anchorTimePointId": null,
            "offsetMinutes": null
          },
          "isBellRow": false,
          "periodLabel": "早課·起板",
          "leadMinutesOverride": null,
          "tasks": [
            {
              "id": "d8-tp-02-t1",
              "action": "起板：打板 → 敲鐘 → 擊鼓",
              "templateRef": null,
              "owners": [
                "fahui"
              ],
              "ownerRaw": "法輝",
              "signal": "板、鐘、鼓",
              "note": null
            }
          ]
        }
      ]
    },
    {
      "id": "d8-sec-2",
      "title": "早課（板→鐘→鼓→大磬起腔，不敲地鐘）",
      "timePoints": [
        {
          "id": "d8-tp-03",
          "time": {
            "kind": "exact",
            "value": "05:10",
            "rangeEnd": null,
            "raw": "05:10",
            "anchorTimePointId": null,
            "offsetMinutes": null
          },
          "isBellRow": false,
          "periodLabel": "早課準備",
          "leadMinutesOverride": null,
          "tasks": [
            {
              "id": "d8-tp-03-t1",
              "action": "調整燈光與空調（禪堂溫度維持 75–76°F）",
              "templateRef": null,
              "owners": [
                "fahui"
              ],
              "ownerRaw": "法輝",
              "signal": null,
              "note": null
            }
          ]
        },
        {
          "id": "d8-tp-04",
          "time": {
            "kind": "exact",
            "value": "05:15",
            "rangeEnd": null,
            "raw": "05:15",
            "anchorTimePointId": null,
            "offsetMinutes": null
          },
          "isBellRow": false,
          "periodLabel": null,
          "leadMinutesOverride": null,
          "tasks": [
            {
              "id": "d8-tp-04-t1",
              "action": "大磬三聲、上三支香 90min；測試音響",
              "templateRef": null,
              "owners": [
                "fahui"
              ],
              "ownerRaw": "法輝",
              "signal": "大磬×3",
              "note": null
            },
            {
              "id": "d8-tp-04-t2",
              "action": "準備主法拈香物料（早晚課不遞主法香）",
              "templateRef": null,
              "owners": [
                "fahui"
              ],
              "ownerRaw": "法輝",
              "signal": null,
              "note": null
            },
            {
              "id": "d8-tp-04-t3",
              "action": "準備手提音響＋mic（早齋過堂念佛號用）",
              "templateRef": null,
              "owners": [
                "fahui"
              ],
              "ownerRaw": "法輝",
              "signal": null,
              "note": null
            }
          ]
        },
        {
          "id": "d8-tp-05",
          "time": {
            "kind": "exact",
            "value": "05:27",
            "rangeEnd": null,
            "raw": "05:27",
            "anchorTimePointId": null,
            "offsetMinutes": null
          },
          "isBellRow": false,
          "periodLabel": null,
          "leadMinutesOverride": null,
          "tasks": [
            {
              "id": "d8-tp-05-t1",
              "action": "放引香段（維那法師起身、三問訊之前）",
              "templateRef": null,
              "owners": [
                "fahui"
              ],
              "ownerRaw": "法輝",
              "signal": "三問訊前",
              "note": null,
              "display": "step"
            }
          ]
        },
        {
          "id": "d8-tp-06",
          "time": {
            "kind": "fuzzy",
            "value": null,
            "rangeEnd": null,
            "raw": "擊鼓時",
            "anchorTimePointId": "d8-tp-05",
            "offsetMinutes": 2
          },
          "isBellRow": false,
          "periodLabel": "儀軌①",
          "leadMinutesOverride": null,
          "tasks": [
            {
              "id": "d8-tp-06-t1",
              "action": "開始發放儀軌（先數好份數）",
              "templateRef": null,
              "owners": [
                "fahui"
              ],
              "ownerRaw": "法輝",
              "signal": "擊鼓時",
              "note": null,
              "display": "step"
            },
            {
              "id": "d8-tp-06-t2",
              "action": "唱到讚佛偈 9 頁「釋迦如來」時收儀軌，隨後大眾坐香",
              "templateRef": null,
              "owners": [
                "fahui"
              ],
              "ownerRaw": "法輝",
              "signal": null,
              "note": null,
              "display": "step",
              "cue": "唱到讚佛偈 9 頁「釋迦如來」時",
              "stepAction": "收儀軌，隨後大眾坐香"
            },
            {
              "id": "d8-tp-06-t3",
              "action": "悅眾止靜後關燈（留佛前燈）、禪堂關門",
              "templateRef": null,
              "owners": [
                "fahui"
              ],
              "ownerRaw": "法輝",
              "signal": null,
              "note": null,
              "display": "step",
              "cue": "悅眾止靜後",
              "stepAction": "關燈（留佛前燈）、禪堂關門"
            },
            {
              "id": "d8-tp-06-t4",
              "action": "維那開靜後（第一聲引磬）開燈、開門",
              "templateRef": null,
              "owners": [
                "fahui"
              ],
              "ownerRaw": "法輝",
              "signal": null,
              "note": null,
              "display": "step",
              "cue": "維那開靜後",
              "stepAction": "（第一聲引磬）開燈、開門"
            }
          ]
        },
        {
          "id": "d8-tp-07",
          "time": {
            "kind": "fuzzy",
            "value": null,
            "rangeEnd": null,
            "raw": "開靜後",
            "anchorTimePointId": "d8-tp-05",
            "offsetMinutes": 40
          },
          "isBellRow": false,
          "periodLabel": "儀軌②",
          "leadMinutesOverride": null,
          "tasks": [
            {
              "id": "d8-tp-07-t1",
              "action": "燈光全亮、大眾放腿、發放儀軌（不用等大眾站起）",
              "templateRef": null,
              "owners": [
                "fahui"
              ],
              "ownerRaw": "法輝",
              "signal": "開靜後",
              "note": null,
              "display": "step"
            },
            {
              "id": "d8-tp-07-t2",
              "action": "韋馱讚 13 頁「南無普眼菩薩摩訶薩」唱完收儀軌",
              "templateRef": null,
              "owners": [
                "fahui"
              ],
              "ownerRaw": "法輝",
              "signal": null,
              "note": null,
              "display": "step"
            }
          ]
        }
      ]
    },
    {
      "id": "d8-sec-3",
      "title": "早齋過堂",
      "timePoints": [
        {
          "id": "d8-tp-08",
          "time": {
            "kind": "exact",
            "value": "06:30",
            "rangeEnd": null,
            "raw": "06:30",
            "anchorTimePointId": null,
            "offsetMinutes": null
          },
          "isBellRow": false,
          "periodLabel": "早齋過堂",
          "leadMinutesOverride": null,
          "tasks": [
            {
              "id": "d8-tp-08-t1",
              "action": "開中央大門",
              "templateRef": null,
              "owners": [
                "fahui"
              ],
              "ownerRaw": "法偉",
              "signal": null,
              "note": null,
              "display": "step"
            },
            {
              "id": "d8-tp-08-t2",
              "action": "男眾先出班、女眾隨後，形成兩路進齋堂",
              "templateRef": null,
              "owners": [],
              "ownerRaw": "",
              "signal": null,
              "note": "監香引導",
              "display": "step"
            },
            {
              "id": "d8-tp-08-t3",
              "action": "行堂於齋堂門口 mic 交接（齋堂 mic ↔ 禪堂 mic），心燈再拿回",
              "templateRef": null,
              "owners": [
                "fahui"
              ],
              "ownerRaw": "法輝",
              "signal": null,
              "note": null,
              "display": "step"
            },
            {
              "id": "d8-tp-08-t4",
              "action": "整理禪凳蓋腿布、乾拖地板",
              "templateRef": null,